{
  "schema_version": "0.1.0",
  "artifact_type": "foundational_execution_intake_receipt",
  "artifact_id": "ARTIFACT-SYNTHETIC-FOUNDATIONAL-EXECUTION-INTAKE-RECEIPT",
  "artifact_version": 1,
  "research_layer": "LAYER_1_FOUNDATIONAL_RESEARCH",
  "payload_locator": "examples/foundational-execution-intake.example.json",
  "payload_digest": {
    "algorithm": "SHA-256",
    "value": "bbbbbbbbbbbbbbbbbbbbbbbbbbbbbbbbbbbbbbbbbbbbbbbbbbbbbbbbbbbbbbbb",
    "scope": "RAW_FILE_BYTES",
    "status": "RECORDED"
  },
  "binding_mode": "EXTERNAL_DIGEST_RECEIPT",
  "recorded_at": "2026-07-22T00:00:01Z",
  "claim_boundary": [
    "This receipt example is synthetic and non-evidentiary.",
    "The payload_digest value is a placeholder and is not the raw-byte digest of the example payload."
  ],
  "example_notice": "SYNTHETIC NON-EVIDENCE FIXTURE. A live receipt must recompute SHA-256 over the final payload raw bytes after the payload is immutable."
}
